{"schemaVersion":"3.0.0","specVersion":"film-v1","audience":"software","durationSeconds":15,"fps":30,"totalFrames":450,"style":{"palette":{"roles":{"bg":"#0b0d12","ink":"#f5f7fb","accent":"#4f7cff","muted":"#8a93a6"},"sources":{"bg":"direction","ink":"direction","accent":"brand","muted":"direction"}},"type":{"display":{"fontId":"hm-inter","weight":800},"text":{"fontId":"hm-inter","weight":500},"mono":{"fontId":"geist-mono","weight":400},"scale":"regular"},"motion":{"language":"continuous-take","energy":4,"easing":"expo-out","transitions":"tight"}},"audio":{"music":{"kind":"procedural","style":"mallet","bpm":112},"sfx":"auto","captions":"off"},"texts":{"headline":{"text":"Ship release notes in one click","role":"headline","factIds":["fact_value"]},"cta":{"text":"Try it free","role":"cta","factIds":["fact_cta"]}},"assets":{"dashboard":{"resourceId":"res_dashboard_png","roi":[{"x":0.08,"y":0.12,"width":0.42,"height":0.3}]},"logo":{"resourceId":"res_logo_svg"}},"scenes":[{"id":"hook","start":0,"end":96,"kind":"block","block":"hook-title@1","params":{"textSlot":"headline"},"purpose":"State the promise before the first beat lands"},{"id":"product","start":90,"end":330,"kind":"block","block":"ui-showcase@1","params":{"assetKey":"dashboard","focus":"roi:0"},"transitionIn":{"type":"whip","frames":6},"purpose":"Show the real dashboard and push into the release button","focusFrom":"headline centre","focusTo":"release button"},{"id":"signature","start":330,"end":398,"kind":"custom","module":"scenes/signature/index.js","brief":"The release button press ripples into a stack of published notes.","purpose":"The one moment a block cannot express"},{"id":"cta","start":390,"end":450,"kind":"block","block":"cta-endcard@1","params":{"textSlot":"cta","logoKey":"logo"},"transitionIn":{"type":"crossfade","frames":8},"purpose":"Brand and call to action"}],"treatment":{"message":"Release notes take one click","hook":"Promise headline slams in on frame 0","energyCurve":[{"frame":0,"level":4},{"frame":200,"level":5},{"frame":420,"level":2}],"holds":[{"start":400,"end":450,"reason":"Read the CTA"}],"continuity":"Headline centre leads the eye to the release button, the press carries into the notes, the notes collapse into the logo."}}
